<?xml version="1.0" encoding="UTF-8" ?>
<?xml-stylesheet type="text/xsl" href="xsl/vehiculos.xsl" ?>
<Concesionaria xmlns:xsi="http://www.w3.org/2001/XMLSchema-instance"
			   xsi:noNamespaceSchemaLocation="xsd/vehiculos_schema.xsd" Compania="EnriqueAsociados">
	<ListaVehiculos TiposVehiculos="Motos Carros Camionetas">
		<Motos>
			<Moto motoID="Moto1">
				<Automovil Condicion="Nuevo" Transmision="Manual" Imagen="imagenes/yamaha-mt15.jpg" TipoImagen="jpg">
					<Marca>Yamaha</Marca>
					<Modelo>
						MT-15
						<Anio>2020</Anio>
					</Modelo>
					<Color>Rojo con Negro</Color>
					<Precio>85999.99</Precio>
					<Kilometraje>0</Kilometraje>
					<Descripcion>Con un motor de alta tecnología, una carrocería compacta y un diseño propio de la linea MT de próxima generación, esta nueva y emocionante motocicleta no tiene comparación. Prepárate para activar tu lado oscuro. Porque esta ligera Hyper Naked va a transformar tu mundo. La nueva MT-15, gracias a su aspecto agresivo, demuestra toda su actitud incluso cuando no se mueve. Las nuevas y llamativas luces de posición dobles aportan a esta Hyper Naked ultraligera el aspecto más intimidante de su categoría. La robusta carrocería echada hacia adelante parece lista para atacar en cualquier momento. </Descripcion>
				</Automovil>
			</Moto>
		</Motos>
		<Carros>
			<Carro carroID="cSpark2021">
				<Automovil Condicion="Nuevo" Transmision="Manual" Imagen="imagenes/chevrolet-spark-2020.png" TipoImagen="png">
					<Marca>Chevrolet</Marca>
					<Modelo>
						Spark
						<Anio>2021</Anio>
						<Version>LS 3 Cilindros</Version>
					</Modelo>
					<Color>Azul Metálico</Color>
					<Precio>183700.00</Precio>
					<Kilometraje>0</Kilometraje>
					<Descripcion>Chevrolet Spark es el auto para ti, pues gracias a su tecnología y equipamiento te da info-entretenimiento, conectividad y seguridad únicos.</Descripcion>
				</Automovil>
				<TipoCarro Diseno="Hatchback" />
			</Carro>
			<Carro carroID="fFusion2019">
				<Automovil Condicion="Seminuevo" Transmision="Automatico" Imagen="imagenes/ford-fusion-2019-sedan.jpg" TipoImagen="jpg">
					<Marca>Ford</Marca>
					<Modelo>
						Fusion
						<Anio>2019</Anio>
					</Modelo>
					<Color>Azul Marino Metalizado</Color>
					<Precio>175999.00</Precio>
					<Kilometraje>30000</Kilometraje>
					<Descripcion>Déjate cautivar por Ford Fusion 2020, auto sedán de espectacular, el conjunto de tecnologías pensadas para brindarte una experiencia de conducción llena de confort, dinamismo y seguridad al máximo. ¡Descúbrelo! </Descripcion>
				</Automovil>
				<TipoCarro Diseno="Sedan" />
			</Carro>
			<Carro  carroID="fFusion2020" mejoraCarroID="fFusion2019">
				<Automovil Condicion="Nuevo" Transmision="Manual" Imagen="imagenes/ford-fusion-2020-sedan.jpg" TipoImagen="jpg">
					<Marca>Ford</Marca>
					<Modelo>
						Fusion
						<Anio>2020</Anio>
					</Modelo>
					<Color>Blanco</Color>
					<Precio>265800.00</Precio>
					<Kilometraje>0</Kilometraje>
					<Descripcion>Déjate cautivar por Ford Fusion 2020, auto sedán de espectacular Diseño equipado con Co-Pilot360, el conjunto de tecnologías pensadas para brindarte una experiencia de conducción llena de confort, dinamismo y seguridad al máximo. ¡Descúbrelo! </Descripcion>
				</Automovil>
				<TipoCarro Diseno="Sedan" />
			</Carro>
		</Carros>
		<Camionetas>
			<Camioneta camionetaID="camioneta0001">
				<Automovil Condicion="Nuevo" Transmision="Manual" Imagen="imagenes/ford-ranger-2020.jpg" TipoImagen="jpg" >
					<Marca>Ford</Marca>
					<Modelo>
						Ranger
						<Anio>2020</Anio>
					</Modelo>
					<Color>Azul Metalizado</Color>
					<Precio>424600.00</Precio>
					<Kilometraje>0</Kilometraje>
					<Descripcion>Ya sea que conduzcas por placer o trabajo, Ford Ranger 2020 tiene el Poder y Resistencia necesarios para acompañarte en cualquier actividad. ¡Ford Ranger 2020 tiene todo lo que deseas de una Camioneta Pick Up!</Descripcion>
				</Automovil>
				<TipoCamioneta Diseno="DobleCabina" />
			</Camioneta>
		</Camionetas>
	</ListaVehiculos>
	<PiePagina>
		Estudiante: Enrique Corona Ricaño - Materia: Lenguajes, Estándares y Tecnologías para la Web
	</PiePagina>
</Concesionaria>
